{
  "schema_version": "intake.receipt.v1",
  "receipt_id": "e0000000-0000-4000-8000-000000000001",
  "package_id": "a0000000-0000-4000-8000-000000000001",
  "consumer_id": "c0000000-0000-4000-8000-000000000001",
  "status": "accepted",
  "received_at": "2026-09-24T08:05:00+07:00",
  "manifest_sha256": "0000000000000000000000000000000000000000000000000000000000000000",
  "record_count": 2
}
